{
  "request_id": "req-del-pay-001-jkl012",
  "trade_no": "TRADE-20260615-8865432100",
  "out_trade_no": "ORD-20260615-SHOP001-0042",
  "agreement_no": "AGR-20260601-8800100123456",
  "trade_status": "TRADE_SUCCESS",
  "amount": "299.00",
  "currency": "CNY",
  "buyer_principal_id": "did:act:example.com/user-alice",
  "buyer_agent_id": "did:act:example.com/agent-alice-001",
  "payment_method": "urn:act:payment:example-wallet",
  "payment_time": "2026-06-15T09:00:02Z",
  "deducted_amount_total": "1499.00",
  "timestamp": "2026-06-15T09:00:02Z"
}
